track_name,artist,raw_lyrics,primary_valence,dominant_emotion,notes,text,m1_valence,m2_valence,human_binary,m1_binary,m2_binary,m1_valence_4class,m2_valence_4class,m1_error_4class,m2_error_4class,error_type
I'm Gonna Be Alright (feat. Nas),Nas,"Oh, yes Yes, I did, baby Yes, I did [Verse 1] It's funny 'cause for a while I walked around with a smile But deep inside, I could hear Voices telling me this ain't right Don't you know it's not for you? I always knew what I had to do But it's hard to get away 'Cause I love you, I just tried to stay [Chorus] I used to say I couldn't do it but I did it (Yes, I did) After telling everybody that I wasn't with it (Oh, yes) Though it brings tears to my eyes, I can feel it And I know inside I'ma be alright (I'ma be alright) I said I couldn't do it but I did it (Yes, I did) After telling everybody that I wasn't with it (Oh, yes) Though it brings tears to my eyes, I can feel it And that voice inside says I'm gonna be alright [Verse 2] Friends of mine say to me Say you got control over me You're not alone, I played my part I saw the way you were from the start Could I expect so much from you? You had a girl when I first met you Did the best that you could do Now I realize I can't change you See Jennifer Lopez LiveGet tickets as low as $35You might also like[Chorus] I used to say I couldn't do it but I did it (Ooh) After telling everybody that I wasn't with it Though it brings tears to my eyes, I can feel it And I know inside I'ma be alright (Be alright) I said I couldn't do it but I did it (Yes, I did it) After telling everybody that I wasn't with it (Oh, yes) Though it brings tears to my eyes, I can feel it And that voice inside says I'm gonna be alright [Bridge] Said I wouldn't walk away Some days I want to stay (Days I want to stay) But leaving you is what I need (Need to do) to do to be okay (For me to be okay) Never thought it would be true (Would be true) Me living without you (Living without you) But now it's time for me to make that move, oh woah Ah, ah [Chorus] I used to say I couldn't do it but I did it (But I did, baby) After telling everybody that I wasn't with it (Wasn't with it) Though it brings tears to my eyes, I can feel it (To my eyes) And I know inside I'ma be alright (Be alright) I said I couldn't do it but I did it (But I did) After telling everybody that I wasn't with it (Wasn't with it) Though it brings tears to my eyes, I can feel it And that voice inside says I'm gonna be alright I used to say I couldn't do it but I did it (Oh, no) After telling everybody that I wasn't with it Though it brings tears to my eyes, I can feel it And I know inside I'ma be alright (Be alright) I said I couldn't do it but I did it After telling everybody that I wasn't with it (I wasn't, no) Though it brings tears to my eyes, I can feel it And that voice inside says I'm gonna be alright I used to say I couldn't do it but I did it After telling everybody that I wasn't with it Though it brings tears to my eyes, I can feel it And I know inside I'ma be alright I said I couldn't do it but I did it After telling everybody that I wasn't with it Though it brings tears to my eyes, I can feel it And that voice inside says I'm gonna be alright I used to say I couldn't do it but I did it After telling everybody that I wasn't with it Though it brings tears to my eyes, I can feel it And I know inside I'ma be alrightEmbed",Negative,resilience/defiance,"irony or sarcasm
","Oh, yes Yes, I did, baby Yes, I did [Verse 1] It's funny 'cause for a while I walked around with a smile But deep inside, I could hear Voices telling me this ain't right Don't you know it's not for you? I always knew what I had to do But it's hard to get away 'Cause I love you, I just tried to stay [Chorus] I used to say I couldn't do it but I did it (Yes, I did) After telling everybody that I wasn't with it (Oh, yes) Though it brings tears to my eyes, I can feel it And I know inside I'ma be alright (I'ma b",Positive,Positive,Negative,Positive,Positive,Positive,Positive,True,True,irony/sarcasm
Chicago Freestyle (feat. Giveon),Drake,"Two-thirty, baby, won't you meet me by The Bean? Too early, maybe later you can show me things You know what it is whenever I visit Windy city, she blowin' me kisses, no Thirty degrees, way too cold, so hold me tight Will I see you at the show tonight? Will I see you at the show tonight? [Verse 1: Drake] Ayy, truck to the plane to the truck Truck to the hotel lobby Me, I go through underground garages Presidential suite on deposit Elevator up to the room Shower up and then we hit the club Touch down, gotta see what's up Area code in my phone What numbers do I still have? Who do I know from the past? Hit one, she say she got a man Hit another one, it goes green Must've changed phones on the team 'Member when you let me in between That was 2017 All good, Chubbs will look around Find one that seem my type That my dawg and he know what I like He done found me plenty in my life Problem is, I meet a girl tonight Then I go and treat her too nice Galleria credit card swipes I don't even know if she a wife See Drake LiveGet tickets as low as $170You might also like[Pre-Chorus: Drake] But I do know one thing though Women, they come they go Saturday through Sunday, Monday Monday through Sunday, yo Maybe I'll love you one day Maybe we'll someday grow 'Til then, I'll sit my drunk ass on that runway On this one way [Chorus: Giveon] Two-thirty, baby, won't you meet me by The Bean? Too early, maybe later you can show me things You know what it is whenever I visit Windy city, she blowin' me kisses, no Thirty degrees, way too cold, so hold me tight Will I see you at the show tonight? Will I see you at the show tonight? [Verse 2: Drake] Jewelry in the safe on arrival Pistol on J for survival Lot of people gunnin' for the title Lot of people tryna take us viral I'm just tryin' to have a nice night though Waiter brought the check for the meal She said, ""Babe, I think there was a typo"" Nah, girl, I got it, that's light though I could show you bigger things than that It's gon' be a minute 'til I'm back Let me give you images that last AMEX had a limit in the past I had plenty women in the past I done plenty sinnin' in the past You don't need to know, but you can ask Stickin' on your backstage pass All access 'cause you bad You could go wherever with that ass Show to the shower to the truck Truck to the club for the party You go in first with your girls 'Cause I don't know who's out there watchin' [Pre-Chorus: Drake] But I do know one thing though Women, they come they go Saturday through Sunday, Monday Monday, Sunday, yo Maybe I'll love you one day Maybe we'll someday grow 'Til then, I'll sit my drunk ass on that runway On this one way [Chorus: Giveon] Two-thirty, baby, won't you meet me by The Bean? Too early, maybe later you can show me things You know what it is whenever I visit Windy city, she blowin' me kisses, no Thirty degrees, way too cold, so hold me tight Will I see you at the show tonight? Will I see you at the show tonight?101Embed",Mixed,love/affection,,"Two-thirty, baby, won't you meet me by The Bean? Too early, maybe later you can show me things You know what it is whenever I visit Windy city, she blowin' me kisses, no Thirty degrees, way too cold, so hold me tight Will I see you at the show tonight? Will I see you at the show tonight? [Verse 1: Drake] Ayy, truck to the plane to the truck Truck to the hotel lobby Me, I go through underground garages Presidential suite on deposit Elevator up to the room Shower up and then we hit the club Touch down, gotta ",Neutral,Negative,Negative,Negative,Negative,Neutral-unclear,Negative,True,True,other
Alone (with Nicki Minaj),Nicki Minaj,"Yeah It's Barbie and it's Kim Petras (Woo-ah) [Chorus: Kim Petras] I've been tryna give it to you all night What's it gonna take to get you all alone? I just want you here by my side I don't wanna be here, baby, on my own Yeah, don't you wait, don't think about it Yeah, don't you wait, just come on over now I've been tryna give it to you all night What's it gonna take to get you all alone? [Verse 1: Kim Petras] Oh, look at me, like what you see? I've been feelin' lonely, baby, you got what I need Give me what I like, tryna, uh, tonight Got an appetite that only you can satisfy (Satisfy) I could ride it, ride it, ride it, ride it all night Watch me ride it, ride it, ride it, ride it all night Wanna feel the rush, wanna feel your touch Don't talk your talk unless you're gonna back it up [Pre-Chorus: Kim Petras] If you want me, let me know Tell me now, don't hesitate (Hesitate) You got one chance, baby, don't Let the moment slip away, no You might also like[Chorus: Kim Petras] I've been tryna give it to you all night What's it gonna take to get you all alone? I just want you here by my side I don't wanna be here, baby, on my own Yeah, don't you wait, don't think about it Yeah, don't you wait, just come on over now I've been tryna give it to you all night What's it gonna take to get you all alone? [Verse 2: Nicki Minaj] Kimmy bad (Bad) Nicki ready, yes, we brag We throw jabs, bitch'll get dragged We be like, ""Gag,"" call her Kim Petty (Petty) When I r-ride it, I ride it steady (Steady) Brand new Range, I just painted it Betty (Betty) I set trends from Queens to Beijing ('Jing) I'm not the one that do the imitating ('Ting) Puff, puff, pass 'cause you know we blazing (Blazing) When I put it on him, he say, ""It's amazing"" (Amazing) All this cake, he doin' a tasting (Tasting; mm) I send shots, get ready, they may sting (Brrrr) I-I-It's Barbie and it's Kim Petras (Oh) Main character syndrome, they extras (Okay) We-we-we ain't answerin' questions (Uh-uh) Click on a bitch 'fore she finish her sentence (Sentence) [Pre-Chorus: Kim Petras] If you want me, let me know Tell me now, don't hesitate (Hesitate) You got one chance, baby, don't Let the moment slip away, no (No) [Chorus: Kim Petras] I've been tryna give it to you all night What's it gonna take to get you all alone? I just want you here by my side I don't wanna be here, baby, on my own Yeah, don't you wait, don't think about it Yeah, don't you wait, just come on over now I've been tryna give it to you all night What's it gonna take to get you all alone? [Outro: Kim Petras] No, no, no7Embed",Positive,pride/confidence,polarity inversion,"Yeah It's Barbie and it's Kim Petras (Woo-ah) [Chorus: Kim Petras] I've been tryna give it to you all night What's it gonna take to get you all alone? I just want you here by my side I don't wanna be here, baby, on my own Yeah, don't you wait, don't think about it Yeah, don't you wait, just come on over now I've been tryna give it to you all night What's it gonna take to get you all alone? [Verse 1: Kim Petras] Oh, look at me, like what you see? I've been feelin' lonely, baby, you got what I need Give me wh",Neutral,Negative,Positive,Negative,Negative,Neutral-unclear,Negative,True,True,polarity inversion
I Get Around,2Pac,"Round and 'round (Aw yeah) 'Round and 'round, 'round we go (I get around) 'Round and 'round Still clown with the Underground, when we come around (Step up, step-step up, step up) 'Round and 'round, 'round we go (stronger than ever) 'Round and 'round [Verse 1: 2Pac] Back to get wrecked, all respect To those who break their neck to keep their hoes in check ‘Cause, oh, they sweat a brother majorly And I don't know why your girl keeps pagin' me She tell me that she needs me, cries when she leaves me And every time she sees me, she squeeze me—lady, take it easy! Hate to sound sleazy, but tease me I don't want it if it's that easy Ayo, bust it, baby got a problem saying ""Bye-bye"" Just another hazard of a fly guy You ask ""Why?"", don't matter, my pockets got fatter Now everybody's lookin' for the latter And ain't no need in being greedy, if you wanna see me Dial the beeper number, baby, when you need me And I'll be there in a jiffy Don't be picky, just be happy with this quickie When will ya learn you can't tie me down Baby doll, check it out: I get around You might also like[Chorus: Shock G & 2Pac] What you mean you don't know? Round and round, around we go I get around, the Underground just don't stop for hoes Round and round I get around, still down with the Underground Round and round, around we go I get around, yeah, ayo Shock, let them hoes know Round and round [Verse 2: Shock G & Money B] Now you can tell from my everyday fits I ain't rich So cease and desist with them tricks (Tricks) I'm just another black man caught up in the mix (mix) Tryna make a dollar out of 15 cents (A dime and a nickel) Just 'cause I'm a freak don't mean that we could hit the sheets Baby, I can see, that you don't recognize me I'm Shock G, the one who put the satin on your panties Never knew a hooker that could share me; I get around [Verse 3: Money B & Shock G] What's up, love? How you doin'? (All right) Well, I've been hangin', sangin' tryna do my thang, oh, you heard that I was bangin' Your homegirl you went to school with? That's cool But did she tell you about her sister and your cousin? Thought I wasn't (Uhh) See, weekends were made for Michelob But it's a Monday, my day, so just let me hit it, yo And don't mistake my statement for a clown We can keep in the down low, long as you know that I get around [Chorus: Shock G & 2Pac] 'Round and 'round, around we go 2Pacalypse Now don't stop for hoes, I get around 'Round and 'round 'Round and 'round, around we go Why I ain't call you? Hahahah, please! 'Round and 'round [Verse 4: 2Pac] Fingertips on the hips as I dip Gotta get a tight grip, don't slip; loose lips sink ships It's a trip, I love the way she licks her lips, see me jockin' Put a little twist in her hips ‘cause I'm watchin' Conversations on the phone 'til the break of dawn Now we're all alone, why the lights on? Turn them off! Time to set it off, get you wet and soft Somethin' is on your mind, let it off You don't know me, you just met me, you won't let me Well, if I couldn't have it (Silly rabbit) why you sweatin' me? It's a lot of real Gs doin' time 'Cause a groupie bent the truth and told a lie You picked the wrong guy, baby, if you're too fly You need to hit the door, search for a new guy 'Cause I only got one night in town Break out or be clowned, baby doll are you down? I get around [Outro: Shock G] 'Round and 'round, around we go 'Round and 'round, around we go, uhh 'Round and 'round, around we go 'Round and 'round, around we go 'Round and 'round, 'round we go 'Round and 'round, 'round we go 'Round and 'round, 'round we go, whoa 'Round and 'round we go 'Round and 'round 'Round and 'round 'Round and 'round 'Round and 'round53Embed",Mixed,love/affection,,"Round and 'round (Aw yeah) 'Round and 'round, 'round we go (I get around) 'Round and 'round Still clown with the Underground, when we come around (Step up, step-step up, step up) 'Round and 'round, 'round we go (stronger than ever) 'Round and 'round [Verse 1: 2Pac] Back to get wrecked, all respect To those who break their neck to keep their hoes in check ‘Cause, oh, they sweat a brother majorly And I don't know why your girl keeps pagin' me She tell me that she needs me, cries when she leaves me And every t",Neutral,Negative,Negative,Negative,Negative,Neutral-unclear,Negative,True,True,other
God's Eye,Dave,"Look, I just moved outta London cah' things were really sticky Grey gates, Range Rovers, sittin' pretty You know I loved my G-SHOCKs if you were really with me Before I reach a milli', I'ma buy a Richard Mille Dinner with red wine, her drink is fizzy Can't take the city out the girl, just the girl out the city Only once I've to ask a chick, ""You really with me?"" The way I'm livin' silly, I need her to live it with me I do Seafood Saturdays when I see your girl Only oysters she's ever had were on TFL She wanna BBL but trust me, I'ma treat her well At least one of us makin' sure she eatin' well Orecchiette pasta, I'm in Casa Cruz I should have brought the young Gs 'cause they do bangin' food Cream blazer, white Nike, call me Harvey Dent Bruce Wayne, the timepiece, I brought Batman too Now what we got in common with a game of pool? Havin' eight balls and startin' with a cue I got a crazy life, girl crazy too I got a baby and my baby wanna baby too I wasn't made to be a gangster, I'm takin' a rest That's a home truth that I'll take on the chest You can't be a middleman inside this game of chess If he's taking offense, then I'm takin' a fence I could have been in the bando when they were flyin' buj And feds raided Surbiton but what a right I took 15 minutes, wonder how life would look I got an autobiography, I ain't write a book You as strong as the weakest person that's in your team I used to be happy with a million streams Independent, I don't bother sittin' in a meet' I just warn a label, two million clean Superleggera I'm in the DBS Five-litre V12 sound like DMX When you in love, that's the sweetest sex Passion in the beat, it's like See Dave LiveGet tickets as low as $81You might also like[Verse 2] Look, so many man gotta sit in jail Don't get a visit, mail, man don't even wish 'em well Road's fucked opportunities are thin as well People don't understand, it's a different world I'm so hood but I'm well-spoken She'll pay the bill when Hell frozen Necrophilia, I'm in AP The skeletons I like, they don't sell skulls with Elements of Picasso with just a touch of Disney I was eight hours ahead before I went to Sydney Leonardo DiCaprio meets Leo DaVinci I make peace and make friends after I make history I'm the type to spend five after I make fifty I'm the type to spend fifty after I make five I take mine, a G was taken through the grapevine But the fruits of my labour brought me a great wine Made dua my enemies they get to see a way Ironically they're all people that I would see as prey The man I grow up with into trappin' and movin' Gettin' re' in like I tried to play a prank on Brewster Whole family full of talent, we're the Adenugas Bag of shooters, adolescence with attitude When hard work, opportunity, proper tunin' Meet talent, nigga, do we happen Turnin' your dreams to reality, that's what act is for Makin' reality a dream, that's what rap is for I used to be Ra'Nell, I never had a score We're the show, tell me what we need a channel for? And of course, I hope Jasmine knows she different and her talent raw I share today with the stars of tomorrow I tell my kids I knew Michael before he had awards, huh And if this isn't the proof Let's have it right, Letitia she's the truth I'm feelin' like Kamale, with a scorcher in the coupe How am I a yute and still inspirin' the youths? Let's go to war, I'm hirin' the troops I know my enemies, they conspirin' for a truce But let a man diss me in his Fire in the Booth And he can shout my name out while he's flyin' off a roof6Embed",Mixed,resilience/defiance,polarity inversion,"Look, I just moved outta London cah' things were really sticky Grey gates, Range Rovers, sittin' pretty You know I loved my G-SHOCKs if you were really with me Before I reach a milli', I'ma buy a Richard Mille Dinner with red wine, her drink is fizzy Can't take the city out the girl, just the girl out the city Only once I've to ask a chick, ""You really with me?"" The way I'm livin' silly, I need her to live it with me I do Seafood Saturdays when I see your girl Only oysters she's ever had were on TFL She wan",Neutral,Positive,Negative,Negative,Positive,Neutral-unclear,Positive,True,True,polarity inversion
