track_name,artist,raw_lyrics,primary_valence,dominant_emotion,notes,text,m1_valence,m2_valence,human_binary,m1_binary,m2_binary,m1_valence_4class,m2_valence_4class,m1_error_4class,m2_error_4class,error_type
Codeine Crazy,Future,"Codeine crazy Yeah (8-8-8-8-808 Mafia) Pourin' bubbly, pourin' bubbly Pour that bubbly, pour that bubbly Pour that bubbly We done went through too much, you hear me? (8-8-8-8-808 Mafia) [Refrain] Pour that bubbly Drink that muddy, drink is muddy when we covered in it Yeah, I'm covered in it I was thuggin' it, I was just loving lit That's for them other niggas, that's for the other bitches That ain't for you, dawg, that's for them other niggas That ain't for you, shawty, that's for that other bitch I'm going crazy 'bout it, I'm going codeine crazy That's how I'm living it, I'm feeling lovely I'm drinking bubbly I'm drinking bubbly (Yeah) [Verse 1] Take all my problems and drink out the bottle and fuck on a model, yeah Audemars, this not a carnival, this is a Royal Oak Cartier Dom Perignon, I get down from a brown, I get chauffeured around I pour up with my rounds, I pour up out of town I corrupted your town with them guns and them pounds I grew up on the grounds with them dealers and hounds We order more bottles and fuck on more models and pass 'em around I say everything triple time Rollie, AP, Hublot, triple time I just know the ones you call upon I just had to pay my dawg a bond Looking at me like a triple threat Every time a nigga talk, a check Smoke the kush up like a cigarette Run it back, you hear my intellect (8-8-8-8-808 Mafia) You might also like[Bridge] Celebrating like the championship Celebrating like the championship Celebrate like the championship Celebrate like the championship I told you, I told you, I told you, I told you Hahah, celebrate [Verse 2] Don't tell me you celibate to the mula I just went Rick the Ruler with the jeweler I just went St. Tropez-in' like a goonie Abu Dhabi, nigga straight out the sewer Like a loaded chopper, I'm 'bout to shoot it I'm so fucking sick and tired of these rumors I just dived inside a cutie, we spoonin' Take it back and take a look at yourself Take the lesson, put it all in the air Too many days gone by Sittin' by the phone, waitin' 'til I reply Drying my eyes, believe it or not I could never see a tear fallin' Water drippin' on me like a faucet I just took a bitch to eat at Chipotle Spent another sixty thousand on a Rollie All my diamonds got you brainwashed She sucked my dick, it got my brain washed And for that shit, you got your man popped See what they did to Biggie and Pac Pour a lil', lil' liquor out, pour a lil' more liquor out Pour it out, pour it out, pour it out [Chorus] Codeine crazy, codeine crazy Codeine crazy, codeine crazy Codeine crazy, codeine crazy All this motherfucking money got me codeine crazy [Verse 3] Drownin' in Actavis, suicide When I hit the scene, it's homicide Diamond pinky ring a lollipop Fuck the hate, I pull up in a drop Diamonds colder than a glacier Ballin' harder than the Pacers I been tryin' to have some patience Told my mama she should pray on it Told the streets they gotta wait on it She gon' put a nigga name on it I just dropped a whole thang on it I'm making USD's overseas That's U.S. dollars that you can't achieve Fucked my white girl, she said, ""Nigga, please"" Fuck that white girl, she said, ""Nigga, please"" Playin' poker, now we're back in Stroker I forgot her name but her pussy soakin' When I seen her on the pole Reminded myself when I used to come over Reminded myself when I used to get loaded Remindin' myself that I'm still gettin' loaded The coupe fully loaded, this whip fully loaded This whip fully loaded, the clip fully loaded I try to control it Let's wrap up some bottles, let's pop off some bottles, these niggas too bogus Let's pour up a pint, I'ma fuck around, faint like I'm Kid Cudi, probably I fuck around, faint, I'ma fall on the drank Rockin' Tom Ford, poppin' mollies Married to this motherfuckin' money [Chorus] Codeine crazy, codeine crazy Codeine crazy, codeine crazy Codeine crazy, codeine crazy All this motherfucking money got me codeine crazy [Verse 4] You thought I forgot about us? I know that you know I don't fold under pressure I'm back on the road, I get low on the pedal We live by the codes of the ghetto I'm closing this out with my memo I'm treating this shit like a demo I'm putting my heart and my soul in this shit and some more I'm in that Dolce Gabbana I might get after Madonna I get it crack in the summer Strapped in the 'Lac and the Hummer Fronted a pack to my partner All this lingo got her panties to dropping Fuck the fame, I'm sipping lean when I'm driving All this cash and it ain't nowhere to hide it I'm an addict and I can't even hide it Don't you panic, panoramic companion They was tryna serve me at the arraignment Never comment on it, never complaining I'm taking everything that come with these millions I'm taking everything that come with my children Yeah, yeah [Refrain] Pour that bubbly Drink that muddy, drink is muddy when we covered in it Yeah, I'm covered in it I was thuggin' it, I was just loving lit That's for them other niggas, that's for the other bitches That ain't for you, dawg, that's for them other niggas That ain't for you, shawty, that's for that other bitch I'm going crazy 'bout it, I'm going codeine crazy That's how I'm living it, I'm feeling lovely I'm drinking bubbly [Outro] Codeine crazy, codeine crazy All this motherfucking money got me codeine crazy173Embed",Mixed,"pride/confidence, sadness/loss, resilience/defiance","addiction framed positively (luxury + success); polarity inversion (“lovely” while describing substance abuse)

 models likely overpredicts positive","Codeine crazy Yeah (8-8-8-8-808 Mafia) Pourin' bubbly, pourin' bubbly Pour that bubbly, pour that bubbly Pour that bubbly We done went through too much, you hear me? (8-8-8-8-808 Mafia) [Refrain] Pour that bubbly Drink that muddy, drink is muddy when we covered in it Yeah, I'm covered in it I was thuggin' it, I was just loving lit That's for them other niggas, that's for the other bitches That ain't for you, dawg, that's for them other niggas That ain't for you, shawty, that's for that other bitch I'm going",Neutral,Neutral,Negative,Negative,Negative,Neutral-unclear,Neutral-unclear,True,True,polarity inversion
Shake That,Eminem,"Woo! Shady, Aftermath Look at that bitch Oh, shit, hey (Damn) [Chorus 1: Eminem & Nate Dogg] There she go, shakin' that ass on the flo' Bumpin' and grindin' that pole The way she's grindin' that pole I think I'm losin' control [Verse 1: Eminem] Get buzzed, get drunk, get crunk Get fucked up, hit the strip club Don't forget ones, get your dick rubbed, get fucked Get sucked, get wasted, shit-faceted Pasted, plastered – puke, drink, throw up Get a new drink, hit the bathroom sink, throw up Wipe your shoe clean, got a routine goin' Still got a few chunks on them shoestrings showin' I was dehydrated 'til the beat vibrated I was revived as soon as this bitch gyrated Them hips and licked them lips, and that was it I had to get Nate Dogg here to sing some shit [Verse 2: Nate Dogg] Two to the one, from the one to the three I like good pussy and I like good tree Smoke so much weed, you wouldn't believe And I get mo' ass than a toilet seat Three to the one, from the one to the three I met a bad bitch last night in the D Let me tell you how I made her leave with me: Conversation and Hennessy I've been to the motherfuckin' mountaintop Heard motherfuckers talk, seen 'em drop If I ain't got a weapon, I'ma pick up a rock And when I bust yo' ass, I'm gon' continue to rock Get your ass off the wall with your two left feet It's real easy, just follow the beat Don't let that fine girl pass you by Look real close 'cause strobe lights lie You might also like[Pre-Chorus 1: Nate Dogg] We 'bout to have a party (Turn the music up) Let's get it started (Go 'head and shake your butt) I'm lookin' fo' a girl with a body and a sexy strut Wanna get it poppin', baby? Step right up Some girls, they act retarded Some girls are 'bout it, 'bout it I'm lookin' fo' a girl that will do whatever the fuck I say, every day she be givin' it up [Chorus 2: Nate Dogg] (Now) Shake that ass for me Shake that ass for me, come on, girl Shake that ass for me Shake that ass for me, ah, girl Shake that ass for me Shake that ass for me, come on, girl Shake that ass for me Shake that ass for me [Verse 3: Eminem] I'm a menace, a dentist, an oral hygienist Open your mouth for about four or five minutes Take a little bit of this fluoride rin-inse Swish, but don't spit it; swallow it and now finish, yeah Me and Nate D-o-double-g Lookin' for a couple bitches with some double D's Pop a little champagne and a couple E's Slip it in her bubbly, we finna, finna have a [Pre-Chorus 2: Nate Dogg, Eminem, Nate Dogg & Eminem] We 'bout to have a party (Turn the music up) Let's get it started (Go 'head and shake your butt) I'm lookin' fo' a girl I can fuck in my Hummer truck Apple Bottom jeans and a big ol' butt Some girls, they act retarded (Man, I told you–) Some girls are 'bout it, 'bout it I want a bitch to sit at the crib with no panties on Knows that she can, but she won't say no (Now) Look at this lady all in front of me Sexy as can be, tonight, I want a slut Would you be mine? Heard you was freaky from a friend of mine Now, I hope you don't get mad at me But I told Nate you was a freak, he said he wants a slut Hope you don't mind I told him how you like it from behind [Chorus: Nate Dogg] (Now) Shake that ass for me Shake that ass for me, come on, girl Shake that ass for me Shake that ass for me, ah, girl Shake that ass for me Shake that ass for me, come on, girl Shake that ass for me Shake that ass for me [Pre-Chorus 1: Nate Dogg] We 'bout to have a party (Turn the music up) Let's get it started (Go 'head and shake your butt) I'm lookin' fo' a girl with a body and a sexy strut Wanna get it poppin', baby? Step right up Some girls, they act retarded Some girls are 'bout it, 'bout it I'm lookin' fo' a girl that will do whatever the fuck I say, every day she be givin' it up [Chorus 1: Nate Dogg & Eminem] There she go, shakin' that ass on the flo' Bumpin' and grindin' that pole The way she's grindin' that pole I think I'm losin' control [Outro: Eminem] God And I ain't leavin' without you, bitch! Comin' home with me! And my boy, and his boy And his boy And his girl Haha, Nate Dogg!100Embed",Positive,"joy/celebration, pride/confidence",party/club context; explicit language may bias model negative; sexual objectification not equal to negative sentiment,"Woo! Shady, Aftermath Look at that bitch Oh, shit, hey (Damn) [Chorus 1: Eminem & Nate Dogg] There she go, shakin' that ass on the flo' Bumpin' and grindin' that pole The way she's grindin' that pole I think I'm losin' control [Verse 1: Eminem] Get buzzed, get drunk, get crunk Get fucked up, hit the strip club Don't forget ones, get your dick rubbed, get fucked Get sucked, get wasted, shit-faceted Pasted, plastered – puke, drink, throw up Get a new drink, hit the bathroom sink, throw up Wipe your shoe clean",Negative,Negative,Positive,Negative,Negative,Negative,Negative,True,True,other
Location (feat. Burna Boy),Dave,"JAE5 [Chorus: Burna Boy] If you send me the location Then I'll be right there And make I come check you, my baby No time, no And my dawg is on probation Another five years Me bring girls to his location No time, no [Verse 1: Dave] Send me the location This year about vacations Flight catching, train taking Soon as my nigga off probation Your boyfriend’s on a waiting ting Looking for one wish, on a Ray J ting I pree'd that girl, outrageous ting But she can't see ’cause I got shades and ting Bare girls wanna throw shade and ting No shade, what shade is your foundation in? Darkest grey, the shade I'm in 49 more if your babes wants in I had me a famous ting Goals and tings, gains and tings My house party a babe station Girls wanna chase, it's a status ting See Dave LiveGet tickets as low as $81You might also like[Chorus: Burna Boy] If you send me the location Then I'll be right there And make I come check you, my baby No time, no And my dawg is on probation Another five years Me bring girls to his location No time, no [Verse 2: Dave] Look, playboy, I don't need a Carti I'm captain, I lead the army Bad ratio, I leave the party Three Somalis creepin' on me Your ex wavy, we tsunami Girl from India, sweetest nani Head so good, now I speak Gujarati You hardly, parred me, I'm laughing again I assisted, man, passed to my friend Look, money like the alphabet If you wanna see P’s, gotta pass on the ends Came a long way from a park in the bends To an ’18 plate, man's parking a Benz Far from the rest but I’m far from my best Life is a lesson, I'm passing a test Yes, everyting blessed I don't want drama and I don't want stress My girl got finesse, Caribbean flex Body and chest, take buddy in chest Thank God more, I grew up with less Juss to the right, Rapz to the left Rj in the middle, got Cee to the death Batch full of dogs with the 60’s vets [Chorus: Burna Boy] If you send me the location Then I'll be right there And make I come check you, my baby No time, no And my dawg is on probation Another five years Me bring girls to his location [Refrain: Burna Boy] Nigga I was down but I made it to the top right now (Right now, right now, right now) And I can pull a couple grand out my pocket right now (Right now, right now, right now) Yeah I'm so fly, yeah I'm flyer than a rocket right now (Right now, right now, right now) And all the games you playin' affi stop right now (Right now, right now, right now) [Verse 3: Burna Boy] I pull up on the block, I see everybody watching 'Cause there's diamonds on my chain And there's diamonds on my watch Money moves, Off-White shoes Came straight from Virgil Abloh I've been down, I've been low Had my mattress on the floor Now mi have nuff gyal bellin up Gyal a ring-ring my cellular Mi 'ave a big fat spliff burnin' up Inna the big black Benz, pullin' up Please tell everybody to start pulling up 'Nough champagne from the bar coming up Party hard, make ah live my life, ah [Refrain: Burna Boy] Nigga I was down but I made it to the top right now (Right now, right now, right now) And I can pull a couple grand out my pocket right now (Right now, right now, right now) Yeah I'm so fly, yeah I'm flyer than a rocket right now (Right now, right now, right now) And all the games you playin' affi stop right now (Right now, right now, right now) [Chorus: Burna Boy] If you send me the location Then I'll be right there And make I come check you, my baby No time, no And my dawg is on probation Another five years Me bring girls to his location No time, no18Embed",Positive,"pride/confidence, joy/celebration, love/affection",success narrative (“came a long way”) with slang; UK slang (“tings”) may confuse models; overall upbeat tone,"JAE5 [Chorus: Burna Boy] If you send me the location Then I'll be right there And make I come check you, my baby No time, no And my dawg is on probation Another five years Me bring girls to his location No time, no [Verse 1: Dave] Send me the location This year about vacations Flight catching, train taking Soon as my nigga off probation Your boyfriend’s on a waiting ting Looking for one wish, on a Ray J ting I pree'd that girl, outrageous ting But she can't see ’cause I got shades and ting Bare girls wanna ",Neutral,Neutral,Positive,Negative,Negative,Neutral-unclear,Neutral-unclear,True,True,slang/AAVE
Let Me Calm Down (feat. J. Cole),Nicki Minaj,"Hold, hold you Let me hold you Wanna hold, hold you Let me hold you Hold, hold you (Let me, let me, let me) [Verse 1: Nicki Minaj] Pull off and I almost hit him He actin' like I ain't always with him My heart sayin' I love him while I'm screamin' that I hate him And ain't no more debatin', this time, it's a ultimatum I never forgot where I was at the first day I met him Yeah, it was love at first sight, but I ain't never sweat him I knew if it was meant to be that one day I would let him Twenty years later, them decisions, I don't regret them Just wish you would give me space when I really need it To be alone in my zone when I'm really heated Just 'cause I am quiet, don't mean you're defeated Wish you ain't need me to feel like you're completed Don't wanna say somethin' mean when I don't mean it Million missed calls, I don't wanna talk Just did a detox, now I wanna spar [Chorus: Nicki Minaj] I wrote a line for you and it was beautiful I made a sign for you to say you're beautiful You're so, so irresistible Take me to somewhere mystical You're so Do you know? For you, I promise I'll try For you, I promise I'll try For you, I promise I'll try See Nicki Minaj LiveGet tickets as low as $68You might also like[Verse 2: J. Cole] Uh, havin' her ain't for the faint of heart She bad as fuck but hard to deal with, and it ain't her fault She got ambition like the niggas, and the vision for herself So she can't rest until she feel like she done made her mark So if you love her, then you gotta learn to play your part Sometimes you gotta play the back But when you do, make sure you play it smart All these niggas want her, so they hatin' hard They talkin' slick and make you wanna pull a rated-R You like her, love her like a brother, like her manager, an A&R Plus a therapist when it start rainin' hard Her life was trauma filled, it left her with a tainted heart Yet you the nigga that she wanna tat her name across But you need patience and a lot of extra faith from God To keep the family together at a time when it's so regular to break apart So God forbid, y'all got a kid, therefore, I hate the thought It's you and her against the world until there ain't no more breath in your lungs I'm just a messenger, but God is who this message is from I wanna send you my respect because I rep for the ones That hold they wifey down despite all of the extras that come Word to Willy Smith, these silly niggas heckle and shun As if they life is somehow perfect and they never been plunged Into a dark place, so I can't respect when it's done It's family first through the worst, comin' second to none, for real [Chorus: Nicki Minaj] I wrote a line for you and it was beautiful I made a sign for you to say you're beautiful You're so, so irresistible Take me to somewhere mystical You're so For you, know For you, I promise I'll try3Embed",Mixed,"sadness/loss, anger/aggression, love/affection",conflicting emotions in relationships; polarity shift within same lines (“love” vs “hate”); emotional nuance hard for model,"Hold, hold you Let me hold you Wanna hold, hold you Let me hold you Hold, hold you (Let me, let me, let me) [Verse 1: Nicki Minaj] Pull off and I almost hit him He actin' like I ain't always with him My heart sayin' I love him while I'm screamin' that I hate him And ain't no more debatin', this time, it's a ultimatum I never forgot where I was at the first day I met him Yeah, it was love at first sight, but I ain't never sweat him I knew if it was meant to be that one day I would let him Twenty years later,",Neutral,Negative,Negative,Negative,Negative,Neutral-unclear,Negative,True,True,polarity inversion
KOD,J. Cole,"Go, go, go Go, go, go Go, go, go Go, go, go [Chorus] This is what you call a flip Ten keys from a quarter brick Bentley from his mama's whip K.O.D., he hard as shit This is what you call a flip Ten keys from a quarter brick Bentley from his mama's whip K.O.D., he hard as shit This is what you call a flip Ten keys from a quarter brick Bentley from his mama's whip K.O.D., he hard as shit This is what you call a flip Ten keys from a quarter brick Bentley from his mama's whip K.O.D., he hard as shit [Verse 1] Wow, niggas been crampin' my style Blowin' my high, they want a reply The number one question is, ""How?"" How does it feel now that you on? How much you worth? How big is your home? How come you won't get a few features? I think you should? How 'bout I don't? How 'bout you just get the fuck off my dick? How 'bout you listen and never forget? Only gon' say this one time, then I'll dip Niggas ain't worthy to be on my shit Haven't you heard? I'm as cold as the tip Tip of the iceberg that tipped the Titanic No tip-toein' around it, my shit is gigantic As big as the fuckin' Atlantic, I'm lit, bitch See J. Cole LiveGet tickets as low as $245You might also like[Chorus] This is what you call a flip Ten keys from a quarter brick Bentley from his mama's whip K.O.D., he hard as shit This is what you call a flip Ten keys from a quarter brick Bentley from his mama's whip K.O.D., he hard as shit This is what you call a flip Ten keys from a quarter brick Bentley from his mama's whip K.O.D., he hard as shit This is what you call a flip Ten keys from a quarter brick Bentley from his mama's whip K.O.D., he hard as shit [Verse 2] How I grew up, only few would've loved 'Member I got my first view of the blood I'm hangin' out and they shoot up the club My homie got pharmaceutical plug I smoke the drug and it run through my vein I think it's workin', it's numbin' the pain Don't give a fuck and I'm somewhat insane Don't give a fuck and I'm somewhat insane Yeah, at this shit daily, sipped so much Actavis I convinced Actavis that they should pay me If practice made perfect, I'm practice's baby If practice made perfect, I'm practice's baby Platinum wrist ridin' in back like Miss Daisy Platinum disc and I own masters, bitch, pay me Y'all niggas trappin' so lack-sical-daisy My nigga sell crack like it's back in the '80s Know a young nigga, he actin' so crazy He serve a few packs and he jack a Mercedes He shoot at the police, he clap at old ladies He don't give a fuck if them crackers gon' hang him Bitches been askin', ""What have you done lately?"" I stacked a few M's like my last name was Shady My life is too crazy, no actor could play me My life is too crazy, no actor could play me [Chorus] This is what you call a flip Ten keys from a quarter brick Bentley from his mama's whip K.O.D., he hard as shit This is what you call a flip Ten keys from a quarter brick Bentley from his mama's whip K.O.D., he hard as shit This is what you call a flip Ten keys from a quarter brick Bentley from his mama's whip K.O.D., he hard as shit This is what you call a flip Ten keys from a quarter brick Bentley from his mama's whip K.O.D., he hard as shit [Outro] Power, greed Money, Molly, weed Percs, Xannys, lean, fame And the strongest drug of them all And the strongest drug of them all Love151Embed",Mixed,"pride/confidence, anger/aggression, sadness/loss",drug culture critique vs glorification; negative themes expressed with confident tone; likely misclassified as positive,"Go, go, go Go, go, go Go, go, go Go, go, go [Chorus] This is what you call a flip Ten keys from a quarter brick Bentley from his mama's whip K.O.D., he hard as shit This is what you call a flip Ten keys from a quarter brick Bentley from his mama's whip K.O.D., he hard as shit This is what you call a flip Ten keys from a quarter brick Bentley from his mama's whip K.O.D., he hard as shit This is what you call a flip Ten keys from a quarter brick Bentley from his mama's whip K.O.D., he hard as shit [Verse 1] W",Negative,Negative,Negative,Negative,Negative,Negative,Negative,True,True,other
