track_name,artist,raw_lyrics,primary_valence,dominant_emotion,notes,text,m1_valence,m2_valence,human_binary,m1_binary,m2_binary,m1_valence_4class,m2_valence_4class,m1_error_4class,m2_error_4class,error_type
We Major,Nas,"[Chorus: Really Doe] You motherfuckers better do your job and roll up And watch how we roll up, and I can't control it, can't hold it, it's so nuts I take a sip of that 'gnac, I wanna fuck I take a hit of that chronic, it got me stuck But really, what's amazing is how I keep blazing Towel under the door, we smoke until the day's end Puff-puff, then pass, don't fuck up rotation Hpnotiq for Henny? Now, nigga, that's a chaser Turn nothing to something, now, pimping, that's a savior Best things are green, now, pimpin', get your paper High off the ground, from stair to skyscraper Cool out, thinking we local, c'mon, homie, we major [Post-Chorus: Kanye West] We major? C'mon, homie, we major We major? C'mon, homie, we major We major! C'mon, homie, we major We major! C'mon [Verse 1: Kanye West] Feeling better than some head on a Sunday afternoon Better than a chick that say ""Yes"" too soon Until you have a daughter; that's what I call karma And you pray to God she don't grow breasts too soon Projects tore up, gang signs is thrown up Niggas hats broke off, that's how we grow up Why else you think shorties write rhymes? Just to blow up? Get they first car and then, IRS show up He ain't never had shit, but he had that nine Nigga come through flicking and he had that shine Put two and two together and a little bad weather Gon' be your whole family on that funeral line Asked the reverend, ""Was the strip clubs cool? If my tips helped send a pretty girl through school?"" That's all I want, like winos want they good whiskey I ain't in the Klan, but I brought my hood with me You might also like[Chorus: Really Doe] You motherfuckers better do your job and roll up And watch how we roll up, and I can't control it, can't hold it, it's so nuts I take a sip of that 'gnac, I wanna fuck I take a hit of that chronic, it got me stuck But really, what's amazing is how I keep blazing Towel under the door, we smoke until the day's end Puff puff, then pass, don't fuck up rotation Hpnotiq for Henny? Now, nigga, that's a chaser Turn nothing to something, now, pimping, that's a savior Best things are green, now, pimpin', get your paper High off the ground, from stair to skyscraper Cool out, thinking we local, c'mon, homie, we major [Post-Chorus: Nas] We major? C'mon, homie, we major We major? C'mon, homie, we major We major! C'mon, homie, we major We major! C'mon, homie, we major [Verse 2: Nas] I heard the beat and I ain't know what to write First line—should it be about the hoes or the ice? Four-fours or Black Christ? Both flows'd be nice Rap about big paper or the black man plight At the studio console, asked my man to the right ""What this verse sound like? Should I freestyle or write? He said, ""Nas, what the fans want is Illmatic, still"" Looked at the pad and pencil, and jotted what I feel Been like twelve years since a nigga first signed Now, I'm a free agent, and I'm thinking it's time To build my very own Motown 'Cause rappers be deprived of executive nine-to-fives And it hurts to see these companies be stealing the life And I love to give my blood, sweat and tears to the mic So y'all copped the LPs and y'all fiends got dealt I'm Jesse Jackson on the balcony when King got killed I survived the livest niggas around Lasted longer than more than half of you clowns Look, I used to cook before I had the game took Either way, my change came like Sam Cooke [Refrain: Tony Williams & Nas] Bah-dah-bah-bah (Yeah, yeah, yeah-yeah, yeah-yeah) Feeling better than I ever felt before today Like better late than never; it's orientation Still, we can make it better, throwing all your cares away Oh, oh, oh, ooh! [Chorus: Really Doe & Tony Williams] You motherfuckers better do your job and roll up And watch how we roll up, and (Bah-dah-bah-bah) I can't control it, I can't hold it, it's so nuts I take a sip of that 'gnac, I wanna fuck I take a hit of that chronic, it got me stuck But really what's amazing is how I keep blazing Towel under the door, we smoke until the day's end Puff-puff, then pass, don't fuck up rotation Hpnotiq for Henny? Now, nigga, that's a chaser (Oh, oh, oh, ooh!) Turn nothing to something, now, pimping, that's a savior (Bah-dah-bah-bah) Best things are green, now, pimpin', get your paper High off the ground, from stair to skyscraper Cool out, thinking we local, c'mon, homie, we major [Post-Chorus: Kanye West & Nas] We major? (C'mon, homie, we major) We major? (C'mon, homie, we major) We major! (C'mon, homie, we major) We major! [Refrain: Tony Williams] Oh, oh, oh, ooh! Bah-dah-bah-bah Feeling better than I ever felt before today But better late than never; it's orientation Still, we can make it better, throwing all your cares away! [Interlude: Kanye West & Tony Williams] Can I talk my shit again? Can I talk my shit again? I can't believe I'm back up in this motherfucker I'ma be late, though I gotta figure out what I'm finna wear Yeah The Roc is definitely in the building G.O.O.D. Music's definitely in the building, ugh I gotta say ""What's up"" to Tony Williams On the vocals! Sings—He sings quite beautifully, don't you agree? Don't you agree? Ugh And Jon Brion on the keys right now And Warryn Campbell on the keys right now So they asked me: ""Why you call it Late Registration, 'Ye?"" 'Cause we takin' these motherfuckers back to school La, la, la, la-la-la-la la If you know this part right here, feel free to sing along La la la la la, la-la-la [Refrain: Tony Williams & Kanye West] Bah-dah-bah-bah (Oh) Feeling better than I ever felt before today (If you feeling good) But better late than never; it's orientation (It's orientation) But we can make it better, throwing all your cares away [Outro] We want you to get used to this Oh, oh, oh, ooh! Bah-dah-bah-bah Ugh, they can't do what we do, baby Uh-uh, uh-uh! They can't do what we do, baby Uh-uh, uh-uh! They can't do what we do, baby Yeah Oh, oh, oh, ooh!51Embed",Mixed,joy/celebration,slang or AAVE,"[Chorus: Really Doe] You motherfuckers better do your job and roll up And watch how we roll up, and I can't control it, can't hold it, it's so nuts I take a sip of that 'gnac, I wanna fuck I take a hit of that chronic, it got me stuck But really, what's amazing is how I keep blazing Towel under the door, we smoke until the day's end Puff-puff, then pass, don't fuck up rotation Hpnotiq for Henny? Now, nigga, that's a chaser Turn nothing to something, now, pimping, that's a savior Best things are green, now, ",Neutral,Negative,Negative,Negative,Negative,Neutral-unclear,Negative,True,True,slang/AAVE
First Person Shooter (feat. J. Cole),Drake,"[Intro: J. Cole & Adonis] (Pew, pew-pew) First-person shooter mode, we turnin' your song to a funeral To them niggas that say they wan' off us, you better be talkin' 'bout workin' in cubicles Yeah, them boys had it locked, but I knew the code Lot of niggas debatin' my numeral Not the three, not the two, I'm the U-N-O Yeah Numero U-N-O Me and Drizzy, this shit like the Super Bowl Man, this shit damn near big as the [Chorus: Drake] Big as the what? (Ah) Big as the what? (Mm) Big as the what? (Ayy) Big as the Super Bowl [Verse 1: Drake] But the difference is it's just two guys playin' shit that they did in the studio Niggas usually send they verses back to me and they be terrible, just like a two-year-old I love a dinner with some fine women when they start debatin' about who the G.O.A.T. I'm like go on 'head, say it then, who the G.O.A.T.? Who the G.O.A.T.? Who the G.O.A.T.? Who the G.O.A.T.? Who you bitches really rootin' for? Like a kid that act bad from January to November, nigga, it's just you and Cole See Drake LiveGet tickets as low as $170You might also like[Chorus: Drake] Big as the what? (Ah) Big as the what? (Mm) Big as the what? (Ayy) Big as the Super Bowl [Verse 2: J. Cole] Niggas so thirsty to put me in beef Dissectin' my words and start lookin' too deep I look at the tweets and start suckin' my teeth I'm lettin' it rock 'cause I love the mystique I still wanna get me a song with YB Can't trust everything that you saw on IG Just know if I diss you, I'd make sure you know that I hit you like I'm on your caller ID I'm namin' the album The Fall Off, it's pretty ironic 'cause it ain't no fall off for me Still in this bitch gettin' bigger, they waitin' on the kid to come drop like a father to be Love when they argue the hardest MC Is it K-Dot? Is it Aubrey? Or me? We the big three like we started a league, but right now, I feel like Muhammad Ali Huh, yeah, yeah, huh-huh, yeah, Muhammad Ali The one that they call when they shit ain't connectin' no more, feel like I got a job in IT Rhymin' with me is the biggest mistake The Spider-Man meme is me lookin' at Drake It's like we recruited your homies to be demon deacons, we got 'em attending your wake Hate how the game got away from the bars, man, this shit like a prison escape Everybody steppers, well, fuck it, then everybody breakfast and I'm 'bout to clear up my plate (Huh, huh, huh) When I show up, it's motion picture blockbuster The G.O.A.T. with the golden pen, the top toucher The spot rusher, sprayed his whole shit up, the crop duster Not Russia, but apply pressure To your cranium, Cole's automatic when aimin' 'em With The Boy in the status, a stadium Nigga [Part II] [Intro: Drake] Ayy, I'm 'bout to, I'm bout to I'm 'bout to, yeah Yeah [Verse: Drake] I'm 'bout to click out on this shit I'm 'bout to click, woah I'm 'bout to click out on this shit I'm 'bout to click, woah I'm down to click out you hoes and make a crime scene I click the trigger on the stick like a high beam Man, I was Bentley wheel whippin' when I was nineteen She call my number, leave her hangin', she got dry-cleaned She got a Android, her messages is lime green I search one name, and end up seein' twenty tings Nadine, Christine, Justine, Kathleen, Charlene, Pauline, Claudine Man, I pack 'em in this phone like some sardines And they send me naked pictures, it's the small things You niggas still takin' pictures on a Gulfstream My youngins richer than you rappers and they all stream I really hate that you been sellin' them some false dreams Man, if your pub was up for sale, I buy the whole thing Will they ever give me flowers? Well, of course not They don't wanna have that talk, 'cause it's a sore spot They know The Boy, the one they gotta boycott I told Jimmy Jam I use a GRAMMY as a door stop Girl gave me some head because I need it And if I fuck with you, then after I might eat it, what? Niggas talkin' 'bout when this gon' be repeated What the fuck, bro? I'm one away from Michael Nigga, beat it, nigga, beat it, what? [Outro: Drake] Beat it, what? Beat it, what? Beat it, what? Beat it, what? Beat it, what? Beat it, what? Beat it, what? Beat it, what? Beat it, what? Beat it, what? Beat it, ayy, beat it, what? Don't even pay me back on none them favors, I don't need it7Embed",Positive,pride/confidence,"slang or AAVE
","[Intro: J. Cole & Adonis] (Pew, pew-pew) First-person shooter mode, we turnin' your song to a funeral To them niggas that say they wan' off us, you better be talkin' 'bout workin' in cubicles Yeah, them boys had it locked, but I knew the code Lot of niggas debatin' my numeral Not the three, not the two, I'm the U-N-O Yeah Numero U-N-O Me and Drizzy, this shit like the Super Bowl Man, this shit damn near big as the [Chorus: Drake] Big as the what? (Ah) Big as the what? (Mm) Big as the what? (Ayy) Big as the ",Negative,Negative,Positive,Negative,Negative,Negative,Negative,True,True,slang/AAVE
AMERICA HAS A PROBLEM (feat. Kendrick Lamar),Kendrick Lamar,"America, America has a problem [Verse] Heard you got that D for me Pray your love is deep for me I'ma make you go weak for me Make you wait a whole week for me I see you watching, fiending I know you want it, scheming I know you need it, drug lord You want it on you? Don't I know You need love, I need some too Do you want this like it wants you? [Refrain] Know that booty gon' do what it want to Can't hit it one time, multiple I know you see these rack-rack-racks on me Now come and get hi-i-i-i-i-igh Twenty, forty, eighty out the trap, hit it with the rap Put it on the map, then we right back Call me when you wanna get hi-i-i-igh Tony Montana with the racks Ivy P on my bag, double G's on my dash Nigga, I'm bad, I'm bad Tell me when you wanna get hi-i-i-igh You might also like[Pre-Chorus] Boy, you can't get no higher than this, no 'Cause love don't get no higher than this, no, no [Chorus] Grind (Grind) Boy, you know I grind (Grind) When I pull up these jeans, you're mine (When I pull up these jeans, you're mine) You're mine (You're mine, you're mine) When I step on the scene, they Can't wait to back it up Your ex-dealer dope, but it ain't crack enough I'm supplying my man, I'm in demand soon as I land Just know I roll with them goons in case you start acting familiar This kind of love, big business, whole slab, I kill for [Pre-Chorus] Boy, you can't get no higher than this, no (Higher) 'Cause love don't get no higher than this, no, no (Higher) [Chorus] Grind (Grind) Boy, you know I grind (Grind) When I pull up these jeans, you're mine (When I pull up these jeans, you're mine) You're mine (You're mine, you're mine) When I step on the scene, they Can't wait to back it up Your ex-dealer dope, but it ain't crack enough I'm supplying my man, I'm in demand soon as I land Just know I roll with them goons in case you start acting familiar This kind of love, big business, whole slab, I kill for [Refrain] Know that booty gon' do what it want to Can't hit it one time, multiple I know you see these rack-rack-racks on me Now come and get hi-i-i-i-i-igh Twenty, forty, eighty out the trap, hit it with the rap Put it on the map, then we right back Call me when you wanna get hi-i-i-igh Tony Montana with the racks Double C's on my bag, double G's on my dash Nigga, I'm bad, I'm bad Tell me when you wanna get hi-i-i-igh15Embed",Mixed,pride/confidence,polarity inversion,"America, America has a problem [Verse] Heard you got that D for me Pray your love is deep for me I'ma make you go weak for me Make you wait a whole week for me I see you watching, fiending I know you want it, scheming I know you need it, drug lord You want it on you? Don't I know You need love, I need some too Do you want this like it wants you? [Refrain] Know that booty gon' do what it want to Can't hit it one time, multiple I know you see these rack-rack-racks on me Now come and get hi-i-i-i-i-igh Twenty,",Neutral,Neutral,Negative,Negative,Negative,Neutral-unclear,Neutral-unclear,True,True,polarity inversion
Incredible Sauce (feat. Dave),Dave,"My whole team's makin' some changes Man's just cuttin' them off, these hungry niggas are craven And I'm just done with them hogs, they're pigs, and I can smell bacon H just sick of this shit, I guess they ain't had the trainin' And I'm levellin' up, took my pictures up in a stadium She wanna go all the way up, but look, bitch, I'm single and datin' I pour my drink in a cup and I'm wavy, I'm different gravy (Gravy) Sometimes I think about stuff, like they're fake and they didn't aid me (Yeah) Pussy, you're callin' my bluff? You been losin', and you still losin' (Lose) I'm gangster, it's Guru (Yeah) Your gang talk tough in the studio My man's outside with a screw loose You fiction niggas arе Hulu My bitch look sexy in Miu Miu I snapped my finger, shе flew there, that lifestyle, she could get used to (Jeez) I see that there's no respect there We 'bout to clean it all up, just be patient 'cause we gon' get there (Gon' get there) We 'bout to even the odds (Odds), just crept there (Crept there) And I'm with all of the dogs (Yeah), we got PetCare (Mm) Gave 'em that corn on the cob [Chorus: Dave] I'm Henry in the Champions League It's on me if I stand on street I need a pack to land on me All cats don't land on feet All good if her face is pretty, but I'm judging her hands and feet Girls say I got handsome features, young boy in a bando, cleanin' I'm hittin' up Bernice Burgos, you can't knock a man for dreamin' I ain't puttin' no women on pedestals He got sauce? That source ain't credible I'm sittin' in Matsuhisa, restaurant's old, but the sauce incredible Don't provoke him, MC soak him, gonna get sauced, incredible You might also like[Verse 2: Giggs] I find these niggas offensive Nowadays I'm just more to myself and I'm careful who I keep friends with (That's right) I made a call up to God, said my prayers 'cause our niggas sendin' (Sendin') Think I'm soft and I'm cuddly I can't get wet, 'cause I turn to gremlin (Jeez) There's no happy endin' Fuck trendin', nigga, I'm trendy (Trendy) It's school days and it's assembly (Assembly) Gang-li lent me extendo, said, ""Hold that"", but it's just temporary (Mm) My bitch don't like when I'm friendly Her friends don't like to offend me And I don't like to offend them So now we're makin' good memories Who can I trust? It's only, it's only us (It's only us) Baby, just don't fall in love (Yeah) I hustle for days (Days), it's me (Yeah) I need somethin' to play with (Jeez) I'm so fuckin' radiant This nigga had so many chances and I couldn't save him (Save him) Your company ain't cut for this table (Yeah) It's Giggs, the hustler staple [Chorus: Dave] I'm Henry in the Champions League It's on me if I stand on street I need a pack to land on me All cats don't land on feet All good if her face is pretty, but I'm judging her hands and feet Girls say I got handsome features, young boy in a bando, cleanin' I'm hittin' up Bernice Burgos, you can't knock a man for dreamin' I ain't puttin' no women on pedestals He got sauce? That source ain't credible I'm sittin' in Matsuhisa, restaurant's old, but the sauce incredible Don't provoke him, MC soak him, gonna get sauced, incredible [Verse 3: Dave] Ganja and it's doused in chemicals We're sellin' relief, it's medical We're sellin' relief, it's chronic We fuck, but it's still platonic You must be smokin' chronic I beef my shadow, I feel like Sonic Buy an Hermès bag in olive Princess treatment, want it? You got it Try and rob my man, but he saw that comin' like That So Raven My girl can't call my phone and tell me she gonna go Afro Nation I grew up with yardies, Asians Grew up with Somalis, ha, bare with me, be patient Time in black and my cash Caucasian Ha-ha, yeah, lingerie on a special occasionEmbed",Positive,pride/confidence,slang or AAVE,"My whole team's makin' some changes Man's just cuttin' them off, these hungry niggas are craven And I'm just done with them hogs, they're pigs, and I can smell bacon H just sick of this shit, I guess they ain't had the trainin' And I'm levellin' up, took my pictures up in a stadium She wanna go all the way up, but look, bitch, I'm single and datin' I pour my drink in a cup and I'm wavy, I'm different gravy (Gravy) Sometimes I think about stuff, like they're fake and they didn't aid me (Yeah) Pussy, you're c",Negative,Negative,Positive,Negative,Negative,Negative,Negative,True,True,slang/AAVE
Praise The Lord (Da Shine) (feat. Skepta),Skepta,"Get it Get it  [Verse 1: A$AP Rocky] Chart climbin' on 'em I'm jumpin' out the window, how I got 'em open Line around the corner, line 'em up the block and over Sometimes I even stop the smokin' when it's time to focus My shades, Dior, my pants, velour Create, explore, expand, conquer  [Chorus: Skepta] I came, I saw, I came, I saw I praise the Lord, then break the law I take what's mine, then take some more It rains, it pours, it rains, it pours I came, I saw, I camе, I saw I praise the Lord, then brеak the law I take what's mine, then take some more It rains, it pours, it rains, it pours  [Refrain: A$AP Rocky] Get it  [Verse 2: Skepta] The dogs, the game's a trap, protect your heart (Yeah) I waited in line, return, refine The new design, it's time to shine To shine, to shine, to shine, to shine To shine, to shine, to shine, to shine To shine, to shine, to shine, to shine To shine, to shine, to shine, to shine To shine, to shine, to shine You might also like[Chorus: Skepta] I came, I saw, I came, I saw I praise the Lord, then break the law I take what's mine, then take some more It rains, it pours, it rains, it pours I came, I saw, I came, I saw I praise the Lord, then break the law I take what's mine, then take some more It rains, it pours, it rains, it pours I came, I saw, I came, I saw I praise the Lord, then break the law I take what's mine, then take some more It rains, it pours, it rains, it pours  [Refrain: A$AP Rocky] Get itEmbed",Positive,pride/confidence,Persona/Narrative voice,"Get it Get it  [Verse 1: A$AP Rocky] Chart climbin' on 'em I'm jumpin' out the window, how I got 'em open Line around the corner, line 'em up the block and over Sometimes I even stop the smokin' when it's time to focus My shades, Dior, my pants, velour Create, explore, expand, conquer  [Chorus: Skepta] I came, I saw, I came, I saw I praise the Lord, then break the law I take what's mine, then take some more It rains, it pours, it rains, it pours I came, I saw, I camе, I saw I praise the Lord, then brеak the",Neutral,Neutral,Positive,Negative,Negative,Neutral-unclear,Neutral-unclear,True,True,metaphorical/performative language
Sidewalks,Kendrick Lamar,"Uh, uh, uh, uh-uh, uh, yeah, like [Verse 1: The Weeknd] I ran out of tears when I was eighteen So nobody made me but the main streets 'Cause too many people think they made me Well, if they really made me, then replace me Homeless to Forbes List, these niggas bring no stress I feel like Moses, I feel like I'm chosen And if you ain't my nigga, then your girl single to me I don't give a damn if a nigga said he knew me Grew up with no father so nobody ever ""son"" me My flow too sick, Kevin Costner couldn't touch me I know you wish that nobody ever love me I feel useless when I'm never makin' money, ah Well, this the life we always fantasized Rich folk problem through a Queen Street nigga's eyes Every time you see me pullin' up in Aventadors Just know we been grindin' on them sidewalks [Chorus: The Weeknd] Sidewalks saved my life They don't ever lie Sidewalks saved my life They show me all the signs You might also like[Post-Chorus: Daniel Wilson] They don't let me down But they lead me on And they don't let me down But they lead me on And they lead me on [Verse 2: Kendrick Lamar] Say, say, say I come from murder one, brung late night melee Say, say, say We hung all summer, sprung mattress with bae bae Say, say, say Trippin' off Dyke and my name strike with pay day Say, say, say Flippin' blue lightnin', tightenin', strapped with AK Say, say, say OG one, told me one, show me one, eight ways How to segue Pussy, power, profit and headache I reminisce my life innocence or life innocent Or life intimate, with fame Light limo tint with light women, dark women in it Aw, Kenny, good game She wanna hang with a Starboy The sun and the moon and star, boy Astronomer, anonymous I line 'em up, we grind 'em up, there's nine of us And five of us have probably fucked She mollied up, I tallied up all the parts, boy Twenty legs, arms, head (Head) Head, head, more head (Head) Oh God, bless the dead (Yup) I'm livin' life, high off life I wear my chokes off to bed I'm the greatest nigga, why you scared to say it? I wanna rock, I wanna rock I wanna cop more land, I never stop I wanna quick advance on a bill if it ain't one Break everything, I'm a hustler, came from [Chorus: The Weeknd] Sidewalks saved my life (Sidewalks saved my life) They don't ever lie Sidewalks saved my life (Sidewalks saved my life) They show me all the signs [Post-Chorus: Daniel Wilson] They don't let me down But they lead me on And they don't let me down But they lead me on And they lead me on154Embed",Mixed,pride/confidence,Reclaimed Language,"Uh, uh, uh, uh-uh, uh, yeah, like [Verse 1: The Weeknd] I ran out of tears when I was eighteen So nobody made me but the main streets 'Cause too many people think they made me Well, if they really made me, then replace me Homeless to Forbes List, these niggas bring no stress I feel like Moses, I feel like I'm chosen And if you ain't my nigga, then your girl single to me I don't give a damn if a nigga said he knew me Grew up with no father so nobody ever ""son"" me My flow too sick, Kevin Costner couldn't touc",Negative,Positive,Negative,Negative,Positive,Negative,Positive,True,True,other
