track_name,artist,raw_lyrics,primary_valence,dominant_emotion,notes,text,m1_valence,m2_valence,human_binary,m1_binary,m2_binary,m1_valence_4class,m2_valence_4class,m1_error_4class,m2_error_4class,error_type
"Hallelujah (feat. Fashawn, Rapsody, Domo Genesis, Vinnie Paz & Action Bronson) [Bonus Track]",Rapsody,"Ayo, hoes holler hallelujah, how I maneuver Passenger's side with Ruger, connoisseur My mind is a sewer, infested with garbage Crime, rhyming and music, disrespecting the market Like a Mexican martyr, boy, I do it to death Nothing left with the carcass, squeeze a Tec on the target Aim the wreck at your artist, flames, a mess on the carpet Then hit everything except for the daughter Cat burglar to a merciful murderer Certainly not with the circus, they trying serve I'm either too hood for my own good Or I'm too good for my own hood Cold is the climate in the hearse Where they found me in the dirt, too demonic for the church I body any and everybody until the day they put my body in the earth This is ghetto gossip while I work [Verse 2: Rapsody] Live from Venice, the southern menace Put me in the Guinness for raising hell up for all the sinners High as tinters, violinists, I string them all along Tied to the flow like water skis in the red ocean Hang like an apostrophe, any MC no Qu'ran I prayed to the God, then prayed on their bodies all at once Sun setting, never regretting the day's events are gone Forgive me for my sins, with everything that I pen my palm Sweaty, sick as spaghetti, my noodle machete sharp To niggas that wanna spark, I pray for you, hallelujah Quick as a cougar when I maneuver You spit manure, eating Peruvian in my rishwa pen Pretty Julia Roberts, I'm a woman robbing you Of your coolness, hard to reach like the stewardess Underground like the sewage is, who fucking with the kid? Did this show evidence? International, such an animal, yeah I really been Killing on the daily, you niggas crazy and asterisk Star, follow me you could probably find the manger I been major, it's Rapsody, boy You might also like[Verse 3: Rakaa] I don't trust the score, I've been baffled by judges' cards before Never leave it in their hands, that's the art of war I learned the proper punching power started from the floor Ground up, renovate, a wall is just another door Resurrected like the phoenix, blazing every stage Spread my wings and fly, but gravity's a heavy cage Hellfire and heaven's rage on every page Revelation propaganda, maybe it's the seven plagues Aiming at the tower, same commercial, different station They stuck on training wheels and tracing paper, vapor chasing I'm half amazing, a quarter sinner, a quarter savior Fascinated, Rakaa seen the wretched paint the righteous painting My travel agent's favorite, preacher's son, no sign of fading The lights weaponized, fireworks at night displaying The blazing arrows fly, a thousand points of light just raining Careful when you're in the quarters, chariots are hydroplaning [Verse 4: Domo Genesis] Fucker, we from the hundreds now Kill a fuck assumption, we bucking off or we ducking down Couple blocks away from the form, check how we run this town You fuckers get this work in abundance, check my circumference now Circle wasn't set stretching, yoga flame Hottest rapper in the streets and they don't even know his name Kept the dope, boy, and I ain't even need a golden chain I'm focused, man, you shooting like a rookie that don't know his range Smoking, watch me go insane, opus and the novacaine Shit was once an open game, we got it by a rope and chain Losing all control of wild paintings in my broken brain I don't think you get it, scrap me down for anything you niggas sending at me Young niggas flexing, mean mugs but trigger happy I'm getting high, I don't ever let a minute pass me I'm feeling famished, bitch, I'm sick of fasting About that action, we can get it cracking Never find shit to match [Verse 5: Evidence] I caught a body, they called it a verse Called the cops, I caught the life, they calling a hearse Pain is easy in reverse, I think pleasure hurts The first rule is win, the second's don't forget the first I think the worst now behind us Hello first-timers, it's welcome to one-liners Question anything against the center of alignment This rock ain't a diamond until it's polished up and shining Decide to ride the retro minutes to the summit's peak Others fall trying to climb it because their stomach weak When we climbing in the summer heat They throwing shade against the team when the others meet Despite the hate when sun'll speak then others peep it After this drops, nothing’s best kept but nothing’s secret If nothing’s nothing, then what the fuck is getting even? Just an odd man out, another duck in season What’s yours is yours, what’s mines is mines It seems as simple as it simply rhymes I keep the simpleton spit in all the sympathy lines I mean it’s Craig G rap, Kane on symphony shines [Verse 6: Vinnie Paz] Slay the Nazarene, you just fire water, I’m gasoline It ain't a day in Philly if I never pass a fiend It’s blood everywhere, similar assassin's scene Purify the water, correlate the Torah, Maccabeen You think that you could box with Vinnie? Dummy, that’s obscene The nine milli silly, dummy, but the mac is mean The downstairs wild gritty, but the attic clean You have unbearable lightness and just a lack of being You ain’t built to shoot the five with me, that’s the thing I’m only after one thing, money, that’s the rings I’m only after one head, money, that’s the king’s A rat gonna be a rat and so he have to sing I got an Ingram MAC-11 and it has a beam And that’s a beautiful love there, it has a gleam You wasn’t in a platoon, cousin, cause that was Sheen Old school, still loyal to guns and Vaseline [Verse 7: Action Bronson] Selling the J dirty boogie, gray hoodie, hit the dougie Pinky rings on racks of chicken nuggets Shit’s like shooting fish in a bucket, dab the hummus I’m in Japan for the summer, land the plane On Jamaica Ave, black rain in the forecast Four-four class, open a stolen Accord door and haul ass Body disposed by Albanian doorman for four grand, aw man I throw the lamb in the ground and leave it overnight You ain’t ever seen this in your life You ain’t used to being where I been to, Curly and my men do You ain’t been through shit I been through This is limited edition, 666 driven Tryna keep from out of prison So I lay low, throwing dice, tomato sauce for the boss Place the bib over the cross, it’s us9Embed",Neutral-unclear,fear/anxiety,Reclaimed Language,"Ayo, hoes holler hallelujah, how I maneuver Passenger's side with Ruger, connoisseur My mind is a sewer, infested with garbage Crime, rhyming and music, disrespecting the market Like a Mexican martyr, boy, I do it to death Nothing left with the carcass, squeeze a Tec on the target Aim the wreck at your artist, flames, a mess on the carpet Then hit everything except for the daughter Cat burglar to a merciful murderer Certainly not with the circus, they trying serve I'm either too hood for my own good Or I'm ",Negative,Negative,Negative,Negative,Negative,Negative,Negative,True,True,other
Energy (Stay Far Away),Skepta,"[Intro: Skepta] Greaze True, ayy [Verse 1: Skepta] I'm tryna get paid, take money, cash cheques You see the set, that's Lash, that's Dex Young C, Young Shorty, Makaveli White bricks, True Religion, on the telly, it's me Wiz got the house full of freaks That's why I haven't been around for a week I'm getting pounds in my sleep I'm at the top of the mountain, it's peak Bring it back before the villain I had a life, real talk, True Religion It's in the blood, in the genes, in the stitching Walked in, no weapon, made a killing Tongue kissing pretty women New iPhone 'cause I'm done with all the bitching Tryna be in my position Keep my shades on 'cause they tryna see the vision [Chorus: Wizkid] She tell me, ""Badman, see, I need your love, see, I need your love"" Mi need you close to me, me, I tell her say me, oh, stay on the road Bad energy stay far away, make it stay far away Just give me love for the night, give me love for the night, gyal, waste no time See Skepta Live Get tickets as low as $133 You might also like THE HEART PART 6 Drake Nyash Na Nyash Chella Thanks Burna Boy [Verse 2: Skepta] Breakfast in bed on a plane I could never complain I was walking with the limp, had the cane Dex said greatness and nothing was the same Now we're set for life I saw the turn up button and I pressed it twice You heard I'm in the club, then my best advice Is put your shoes on and come and get your wife 'Cause we've been having sex just for exercise Every night, man are doing sexercise She looks into my eyes, now she's mesmerised [Chorus: Wizkid] She tell me, ""Badman, see, I need your love, see, I need your love"" Mi need you close to me, me, I tell her say me, oh, stay on the road Bad energy stay far away, make you stay far away Just give me love for the night, give me love for the night, gyal, waste no time [Verse 3: Skepta] Ayy, they better get used to the flex African man, you see the jewels on my neck Black James Bond, that's the new silhouette You see me in the street and I was moving correct Been running around, tryna do the home run Left that girl, she was no fun I tie one, smoke one Big chief Skeppy and I answer to no one Counting my blessings, I'm feeling special Bird's eye view, SK level Give them the Shaku when I dance with the devil Young Fela Kuti, the return of the rebel I told her I need some space Real busy body, never stay in one place And she knows I've got more tricks under my sleeve That's why she never wants me to leave [Chorus: Wizkid] She tell me, ""Badman, see, I need your love, see, I need your love"" Mi need you close to me, me, I tell her say me, oh, stay on the road Bad energy stay far away, make you stay far away Just give me love for the night, give me love for the night, gyal, waste no time",Mixed,love/affection,Persona/Narrative voice,"[Intro: Skepta] Greaze True, ayy [Verse 1: Skepta] I'm tryna get paid, take money, cash cheques You see the set, that's Lash, that's Dex Young C, Young Shorty, Makaveli White bricks, True Religion, on the telly, it's me Wiz got the house full of freaks That's why I haven't been around for a week I'm getting pounds in my sleep I'm at the top of the mountain, it's peak Bring it back before the villain I had a life, real talk, True Religion It's in the blood, in the genes, in the stitching Walked in, no weapon",Neutral,Neutral,Negative,Negative,Negative,Neutral-unclear,Neutral-unclear,True,True,metaphorical/performative language
Verdansk,Dave,"Just had to kick a chick out of the studio, fam, shit's nuts, fam (Hahahaha) Nah, like, in Kyle's words, fam, the truth is madder than fiction, fam It's nuts out here (Oi, ayy, write that shit down) Look [Chorus] I see a ting that I touched, tell me about talkin' stage, gotta tell her, ""Don't force it"" Beef man, pepper and salt it, me and RJ gotta pull up, no talkin' Trap, you ain't got a rack to your name, my bro brick layin', we don't know about Shoreditch Rental, I never insured it, M25, gotta whip that calmly Man try beef with my dargy, Warzone ting how I come third party My little nigga can't lose that cash, I drop YGs, do it like Kehlani I don't rock Gucci or Armani, ST from ST, I can't Squash that beef like fruit and barley, still got a one black star like Kwame [Verse] Three car convoy in Sutton, my mum got matching whips with Yungen Should've made Shanei hold on somethin' But it nevеr would've worked cah the girl too stubborn Young Gs talking my namе on the ends Gotta tell a man, ""Please don't risk it"" On a right day, man ah just frisk him On a wrong day, I'm gettin' man airlifted I'm in Hollywood Hills with a white Rolls Royce And a one brownin' from Compton The Lambo parked just in front Man pull up to the bumper and do it like Konshens She wanna go LV, no problem Went for the cheapest bag, that's nonsense I took a hundred bags from Barclays bank No cap, you can go and ask Ellie That one mine, Bouncing Betty The bag four K, like a HD telly Best believe that I'm back like Nelly Chest petite with a back like jelly I'm seein' man send indirects If you wanna war man, then you better be vocal My right hand got a semi, that's local And this Brownin', I can't post on socials My girl gotta be far from social, I don't wanna see her at Carni' Four-double-eight in the party, LBC how I nicked the Ferrari Girls say we're the littiest batch in South London and, bro, it's a fact Airport, we're going for bants, I hopped out the plane, I ain't going Verdansk What you know about telling a ten-ten to keep her clothes on and moving good? I ain't on beating or misogyny, it's mahogany, I got bougie wood Look, Airbnb with the guys, it's a white man's face that I use to book Chill with the stupid looks or it's gonna be a kettle that I use to cook See Dave LiveGet tickets as low as $81You might also like[Chorus] I see a ting that I touched, tell me about talkin' stage, gotta tell her, ""Don't force it"" Beef man, pepper and salt it, me and RJ gotta pull up, no talkin' Trap, you ain't got a rack to your name, my bro brick layin', we don't know about Shoreditch Rental, I never insured it, M25, gotta whip that calmly Man try beef with my dargy, Warzone ting how I come third party My little nigga can't lose that cash, I drop YGs, do it like Kehlani I don't rock Gucci or Armani, ST from ST, I can't Squash that beef like fruit and barley, still got a one black star like Kwame16Embed",Mixed,anger/aggression,,"Just had to kick a chick out of the studio, fam, shit's nuts, fam (Hahahaha) Nah, like, in Kyle's words, fam, the truth is madder than fiction, fam It's nuts out here (Oi, ayy, write that shit down) Look [Chorus] I see a ting that I touched, tell me about talkin' stage, gotta tell her, ""Don't force it"" Beef man, pepper and salt it, me and RJ gotta pull up, no talkin' Trap, you ain't got a rack to your name, my bro brick layin', we don't know about Shoreditch Rental, I never insured it, M25, gotta whip that ",Negative,Negative,Negative,Negative,Negative,Negative,Negative,True,True,other
Tequila,Dave,"With my Spanish girl, Valeria, super freaky, but she acting diva And all she wants to do is tease a boy, that's why she give me neck kisses when I'm playing FIFA My Latina, Angelina, Colombiana, come from Medellín And all she cares about is weed and sex, half the time we ain't even speaking But if I ain't feeling it, then I'm swervin' My new girl got my old girl hurtin' The last ex that I had was a lighty, but the next X that I get is a German That's a X5 or a six door, I'll get it cocaine white like a gringo I got a link at Stoney for clothes, so this hoodie that I own cost ocho cinco [Chorus] With my Spanish girl, playing FIFA Mas tequila? Sí señorita WhatsApp only, I'm overseas, I'm in Beverley Hills, I might phone Genita With my Spanish girl, playing FIFA Mas tequila? Sí señorita WhatsApp only, I'm overseas, I'm in Beverley Hills, I might phone Genita [Verse 2] Dineros, what I'm out to get Sombrero, I get hat and then I'm out again Got an A1 chica with a drive like a three litre That's what she needs D for like the alphabet I'm exclusive, not for anyone And many girls wanna diss 'cause they ain't gettin' none I told my baby, ""Don't worry what a hoe say"", 'cause me and you both know you're the special one And if I can't get a ring for your hand, you can leave Chelsea and fly into Milan You click once, I'ma give you what you want, but you still won't ask for a thing from a man Do you think that you can tell a guy to give you the world when you can't do a thing for a man? My baby don't judge me for breakin' the law, with squares, she was there taking trips to the bank See Dave LiveGet tickets as low as $81You might also like[Chorus] With my Spanish girl, playing FIFA Mas tequila? Sí señorita WhatsApp only, I'm overseas, I'm in Beverley Hills, I might phone Genita With my Spanish girl, playing FIFA Mas tequila? Sí señorita WhatsApp only, I'm overseas, I'm in Beverley Hills, I might phone Genita [Bridge] If I ain't feeling it, then I'm swervin' My new girl got my old girl hurtin' The last ex that I had was a lighty, but the next X that I get is a German That's a X5 or a six door, I'll get it cocaine white like a gringo I got a link at Stoney for clothes, so this hoodie that I own cost ocho cinco [Chorus] With my Spanish girl, playing FIFA Mas tequila? Sí señorita WhatsApp only, I'm overseas, I'm in Beverley Hills, I might phone Genita With my Spanish girl, playing FIFA Mas tequila? Sí señorita WhatsApp only, I'm overseas, I'm in Beverley Hills, I might phone Genita10Embed",Mixed,love/affection,irony/sarcasm,"With my Spanish girl, Valeria, super freaky, but she acting diva And all she wants to do is tease a boy, that's why she give me neck kisses when I'm playing FIFA My Latina, Angelina, Colombiana, come from Medellín And all she cares about is weed and sex, half the time we ain't even speaking But if I ain't feeling it, then I'm swervin' My new girl got my old girl hurtin' The last ex that I had was a lighty, but the next X that I get is a German That's a X5 or a six door, I'll get it cocaine white like a grin",Neutral,Neutral,Negative,Negative,Negative,Neutral-unclear,Neutral-unclear,True,True,irony/sarcasm
Mains,Skepta,"Boy, don't sleep in the trap house Nah, that's risky Ain't no deals in the trap house If you want three, that's sixty Boy, don't sleep in the trap house Nah, that's risky Yeah, greaze, uh [Chorus: Skepta] Boy, don't sleep in the trap house Nah, that's risky Ain't no deals in the trap house If you want three, that's sixty Had Charlie, man, I had Whitney Had Bobby, man, I had Britney Criminal pickney now I got large amounts Boy, I need a different account I cannot sit in the house All my niggas tryna eat I need to figure it out Just tell me the floor, show me the door My niggas kicking 'em down Flicky in the whip, they wish I would slip But I cannot give 'em the clout You might also like[Verse 1: Skepta] Got my dream girl in my real life In the dunya but I'm living nice Bought a chain, didn't see the price Diamonds on me, that Vanilla Ice Who said that I'm civilised? I'm a villain, you can see it in my eyes Spin the wheel, tryna win the prize Hit the jackpot, split it with the guys Man, I been the guy [Verse 2: Young Adz] I'ma whip that crack like banana pudding again (Hee, hee) When I step in the bando, fiends and the workers act like Vladimir Putin just came (Just came) Niggas taking the wave Just let 'em have fun with it, tell 'em to run with it (Ha, yeah, yeah) I got some coke at my sister's I got a gun in my brother's crib (Grrah, hee) And if we see 'em on the mains, that's fire on the mains (Huh, fire on the mains) Got a little three-two concealed in my boxers, call that fire in the mains (Fire in the mains) I was on tour with the hittas on deck, had fire on the stage (Hee, hee) Bro's so tapped, if he see a opp little sister, he'll probably fire off the stage [Verse 3: Chip] What do you reckon? How I survive? Impeccable tekkers No point rocking a vest when you stepping Neck and above how niggas be wetting Cheffing, kweffing, shooting, booting, London's mad End of discussion Fuck all the talk, my nigga, do sumtin' You're not the GOAT, my nigga, you mutton I was 18 in hella jewels Now I'm 28 in hella jewels I'll be 38 in hella jewels You been hating on me, who the hell are you? Chip in the dance, two-step bussin' If I got my Cuban on, I won't tuck it Look in my corner, he just see artists Ain't got a clue that the mandem will rush him (Mad mad) Hands on man, no hands on grams, but I still got my hands on grands Gyal in my bed straight after the booth Damn right, got hands on plans Scales in my rucksack cah' I gotta weigh my ting when it lands Two and a Q, no intent to supply I get high, it's a percy pack [Verse 4: Skepta] I had to buss my hood like I was outside in the rain Anyone can dead Push me to the edge, I'm gripping the pole like I'm riding the train Niggas ain't shooting, niggas just gassing it, I put a rack on it All my niggas is savages Bought a skeng and then I park it by the garages See your girl on the ends Now she wanna be friends I look in her eyes And I see she want a friends with benefits, no, we ain't gotta pretend Ex man talk about beef, man catch him eating chicken and fries Yeah, you might see my niggas in the video But they're coming in disguise [Verse 5: Young Adz] Hop out, a nigga surprised (Uh huh) Sold out Ally Pally twice (Uh huh) VVS and all the ice with boogers Mesmerise memories (Uh huh) Treating the Range like a sports car And I ain't never seen another nigga do it big Saw what I spent on my daughter Now she's screaming ""Goals"" and she wanna have my kids Let the fiend try that dark, she said Jesus, Nazareth Mummy hit me on WhatsApp Jakes are looking for me where my nanny lives Last night I was bagging up crack and dark on my silver plaque If a nigga try rob my gold, that's bronze tips in that silver wap And I just put coke on the stove, gotta turn it down Gotta turn on the tap I got a nigga on the way but the crack ain't dried yet He want a 4 and half, I just turn on the fan He want a 4 and half, I just turn on the fan Tell the opps that we got larger waps Cum in her pussy, a lava lamp [Verse 6: Chip] Growing up now, I gotta move different I only cheat if it's two women Baby girl told me she want to be wifey I asked her, ""What do you do different?"" Good girl said she want a man like me She want a man like me cah' I've never been nicked I was 18 tryna buy me a crib You want to talk on my name But you've never been lit [Chorus: Skepta] Boy, don't sleep in the trap house Nah, that's risky Ain't no deals in the trap house If you want three, that's sixty Had Charlie, man, I had Whitney Had Bobby, man, I had Britney Criminal pickney now I got large amounts Boy, I need a different account I cannot sit in the house All my niggas tryna eat I need to figure it out Just tell me the floor, show me the door My niggas kicking 'em down Flicky in the whip, they wish I would slip But I cannot give 'em the clout7Embed",Positive,pride/confidence,Persona/Narrative Voice,"Boy, don't sleep in the trap house Nah, that's risky Ain't no deals in the trap house If you want three, that's sixty Boy, don't sleep in the trap house Nah, that's risky Yeah, greaze, uh [Chorus: Skepta] Boy, don't sleep in the trap house Nah, that's risky Ain't no deals in the trap house If you want three, that's sixty Had Charlie, man, I had Whitney Had Bobby, man, I had Britney Criminal pickney now I got large amounts Boy, I need a different account I cannot sit in the house All my niggas tryna eat I ne",Neutral,Neutral,Positive,Negative,Negative,Neutral-unclear,Neutral-unclear,True,True,metaphorical/performative language
